imgid,filename,caption,sentid
29369,7343282792.jpg,Two guys shaking their hands before the competition,146848
29369,7343282792.jpg,Two men shaking hands outdoors in front of flags,146849
23059,4811949930.jpg,"A family of a mother in purple, a father in a green shirt and khaki shorts and their two children are bringing luggage somewhere.",115295
23059,4811949930.jpg,A family with young children with suitcases walk down a paved area.,115296
23059,4811949930.jpg,A man in cargo shorts pulling two rolling cases.,115297
23059,4811949930.jpg,A family walking with three pieces of luggage.,115298
23059,4811949930.jpg,A family walking down the street with luggage.,115299
8768,2832594839.jpg,An adult and a kid are both wearing yellow shirts and the child is putting glue on a piece of paper.,43840
8768,2832594839.jpg,The little boy looks like he is doing a school project while his dad watches him.,43841
8768,2832594839.jpg,A boy and a man who seems to be the boys father work on an art project together.,43842
8768,2832594839.jpg,A small boy is working on a project while an older man looks on.,43843
8768,2832594839.jpg,A man with his son that are together preparing a art piece.,43844
5374,2396100671.jpg,A young boy sits on his bike wearing a dragon costume.,26870
5374,2396100671.jpg,A child wearing a costume rides a bike in winter.,26871
5374,2396100671.jpg,A little boy on bike wearing dragon costume,26872
5374,2396100671.jpg,A boy in a costume is sitting on a bike.,26873
5374,2396100671.jpg,A child in a dragon costume on a bike.,26874
19649,4495716228.jpg,"Three team players dressed in red ball cap blue with white jerseys overjoyed with excitement, as two toerh men in red ball caps walk with them on the freshly mown green grass.",98245
19649,4495716228.jpg,A group of back-facing baseball players are running and hopping down the field.,98246
19649,4495716228.jpg,"Baseball players walk as a group on the field, and some jump to celebrate.",98247
19649,4495716228.jpg,Two people with baseball jerseys who are jumping in the air.,98248
19649,4495716228.jpg,Several sports players do exercises on the field.,98249
24218,4903291011.jpg,"One man lays down on a lawn table in the background while an older lady stands, looking down in the foreground",121090
24218,4903291011.jpg,A man is passed out asleep on a patio table while his mother looks down at the ground.,121091
24218,4903291011.jpg,A man in black is sitting at a table taking a photo of an older woman on a patio.,121092
24218,4903291011.jpg,An older lady walking by a man who is laying on the table looking at something.,121093
24218,4903291011.jpg,A younger man takes a picture of what an older women stands over.,121094
451,1148095714.jpg,A young dark-skinned child in a long blue coat is chasing a ball.,2255
451,1148095714.jpg,A little boy in a suit jacket is playing with a ball.,2256
451,1148095714.jpg,Black boy in sandals playing with a ball in the grass,2257
451,1148095714.jpg,A kid may be playing soccer while in a suit.,2258
451,1148095714.jpg,A young african boy kicking a ball.,2259
16036,3719461451.jpg,The white pelican is flying over the ocean.,80180
16036,3719461451.jpg,A white Pelican is flying over the ocean.,80181
16036,3719461451.jpg,A very large bird flying over water.,80182
16036,3719461451.jpg,A pelican flies over the water.,80183
16036,3719461451.jpg,White gull flying over ocean,80184
25997,532914728.jpg,Small boy holding is arm out to balance himself while he goes down the fairground slide.,129985
25997,532914728.jpg,A little boy in a striped shirt going down a light and dark blue slide.,129986
25997,532914728.jpg,Small boy in blue striped shirt coming down large slide.,129987
25997,532914728.jpg,A little boy is sliding down a teal and blue slide.,129988
25997,532914728.jpg,A small boy is riding a water slide,129989
2793,196016880.jpg,A man reads in a red shirt and sunglasses reads from a Tonka children's book while wearing a face mask.,13965
2793,196016880.jpg,A man reads a Tonka truck book in the doctors office while wearing a face mask.,13966
2793,196016880.jpg,A man in a paper breathing mask is reading a book.,13967
2793,196016880.jpg,A man with a blue mask reading a book.,13968
2793,196016880.jpg,A man reading a toy manual outside.,13969
11749,3207343907.jpg,A crowd gathered at an ice skating park in the winter.,58745
11749,3207343907.jpg,A crowd of people ice skating outside in winter.,58746
11749,3207343907.jpg,A large crowd of people ice skating outdoors.,58747
11749,3207343907.jpg,A lot of people iceskate on a cold day.,58748
11749,3207343907.jpg,A large crowd of people ice skating.,58749
25908,5288534547.jpg,A young boy is sitting on the floor trying to take off his boots.,129540
25908,5288534547.jpg,A young boy puts on his boots at the top of a flight of stairs.,129541
25908,5288534547.jpg,A young boy is sitting on a rug and putting his boots on.,129542
25908,5288534547.jpg,A boy wearing a gray and green shirt puts on his shoes.,129543
25908,5288534547.jpg,Young boy taking his boots off.,129544
1627,146577645.jpg,A kayaker goes through the waves holding his paddle.,8135
1627,146577645.jpg,A person maneuvers rapids while riding a watercraft.,8136
1627,146577645.jpg,A man paddles down the rapids in a kayak.,8137
1627,146577645.jpg,Man kayaking through rough waters.,8138
1627,146577645.jpg,A man with a red helmet kayaking.,8139
19074,4434578155.jpg,An elderly couple in heavy coats are looking at black and white photos displayed on a wall.,95370
19074,4434578155.jpg,A couple dressed in winter coats admire framed photos on a white wall.,95371
19074,4434578155.jpg,Two people in coats examine black and white photos in a gallery.,95372
19074,4434578155.jpg,Two men are looking at some old photographs hanging on a wall.,95373
19074,4434578155.jpg,Couple looking at photos in a gallery.,95374
9815,2966221503.jpg,"A smiling woman cleaning a backyard pool while a man stands nearby with his hands on his hips, looking at the pool.",49075
9815,2966221503.jpg,A woman is cleaning a pool with a net while a man watches.,49076
9815,2966221503.jpg,Chubby couple enjoy scooping garbage out of their pool.,49077
9815,2966221503.jpg,A couple are seen trying to skim a backyard pool,49078
9815,2966221503.jpg,A man watches as a woman cleans a pool.,49079
4725,2309860995.jpg,A woman wearing a black coat and sunglasses is standing in front of a man walking away with a backpack.,23625
4725,2309860995.jpg,There is a woman in a black jacket and sunglasses and a man in a white shirt with his back turned.,23626
4725,2309860995.jpg,"The woman in the dark coat is facing the camera, while the man in the blue shirt faces away.",23627
4725,2309860995.jpg,A woman in a black overcoat and red-hair with man in white walking behind her,23628
4725,2309860995.jpg,A woman wears sunglasses and a black coat as she walks.,23629
8396,2775461796.jpg,A man carrying a baby crosses the street on a bike along side a younger kid.,41980
8396,2775461796.jpg,An adult male and a small child look to their left as they ride bicycles.,41981
8396,2775461796.jpg,A father and children ride bikes in city street.,41982
8396,2775461796.jpg,Crowds peddle their bikes across a city street.,41983
8396,2775461796.jpg,Several people are riding bikes.,41984
26719,5687925512.jpg,A gentleman wearing blue jeans and a gray shirt washes a silver car outdoors with two white buckets in the foreground.,133595
26719,5687925512.jpg,A man is outdoors washing his car with soap and water.,133596
26719,5687925512.jpg,A car wash worker cleaning the interior of the wheel.,133597
26719,5687925512.jpg,A man is washing a car with soapy water.,133598
26719,5687925512.jpg,A man in a blue hat washes a silver car.,133599
16878,388604469.jpg,Four guys in striped shirts playing music instruments in a restaurant.,84390
16878,388604469.jpg,A Mariachi band performing in the back of a restaurant.,84391
16878,388604469.jpg,Small Hispanic band plays in a restaurant.,84392
16878,388604469.jpg,String band performs in restaurant.,84393
16878,388604469.jpg,A band gives a performance.,84394
12315,327298970.jpg,A varied group of people are on all fours with a woman laying on top of them; a man is seen attempting to jump or flip over them.,61575
12315,327298970.jpg,"A group of volunteers forming an obstacle, while an acrobat performs a jump over them, and the crowd looks on in anticipation.",61576
12315,327298970.jpg,"While in the street, a young man is jumping over a number of other individuals as a crowd looks on.",61577
12315,327298970.jpg,A man is performing acrobatics over a group of people kneeling on the ground.,61578
12315,327298970.jpg,Man does a trick flipping over several people lined up at a street fair.,61579
21383,4679233085.jpg,Two young children are asleep on a couch.,106915
21383,4679233085.jpg,Two brothers take a nap on a gray couch.,106916
21383,4679233085.jpg,Two children asleep on a couch.,106917
21383,4679233085.jpg,Two kids sleeping on a futon,106918
21383,4679233085.jpg,Two kids asleep on a futon.,106919
10064,3002448718.jpg,"Four women in front of Odeon wear similar black, pink and white superman type shirts and jean skirts.",50320
10064,3002448718.jpg,"Girls in matching outfits, one holding inflatable toy, outside of ODEON building.",50321
10064,3002448718.jpg,A group of girls stands wearing jean skirts and superman shirts.,50322
10064,3002448718.jpg,Girls walking in the street on a sunny day.,50323
10064,3002448718.jpg,A group of women with black shirts.,50324
23610,4853382595.jpg,A young woman wearing a white cardigan and shorts sitting on the edge of a platform that is raised above a body of water.,118050
23610,4853382595.jpg,A girl on the phone among the tall cranes in the distance.,118051
23610,4853382595.jpg,A lady sits on the end of a pier high above the water.,118052
23610,4853382595.jpg,Three young ladies looking off into the open water.,118053
23610,4853382595.jpg,Three people sit on the end of a pier.,118054
12567,3307810562.jpg,A red-haired man wearing a suit stands near an exit door.,62835
12567,3307810562.jpg,A man in a suit and tie with a sad look on his face.,62836
12567,3307810562.jpg,A man standing alone with a sad look upon his face.,62837
12567,3307810562.jpg,Man wearing a suit with green tie standing.,62838
12567,3307810562.jpg,Executive man on a suit waiting.,62839
20691,4614283206.jpg,"Four people, two of whom can be seen wearing conference badges, are grouped around a long table with several laptops on it.",103455
20691,4614283206.jpg,Three men and a woman have laptops and are standing in front of a projection screen appearing to be conversing.,103456
20691,4614283206.jpg,"A meeting room with a large screen, several people talking, and computers.",103457
20691,4614283206.jpg,Workers at an International Freestyle Motocross press conference.,103458
20691,4614283206.jpg,Four people talking in a presentation room.,103459
22209,4741408543.jpg,Children walking hand in hand while participating in a festive and costumed town event.,111045
22209,4741408543.jpg,A girl and two boys dressed in bright ethnic garb are walking together.,111046
22209,4741408543.jpg,"A female child walking, holding the hands of two male children.",111047
22209,4741408543.jpg,Children in festive attire walking with others on a street.,111048
22209,4741408543.jpg,People in quaint customs walk along a road.,111049
29935,7754652028.jpg,"A black man wearing tan shorts, a yellow sweatshirt, and a baseball cap is holding up his hand and talking to an Asian woman posing with another young black man while they are holding red flags with yellow stars.",149675
29935,7754652028.jpg,Two guys stop to take a picture while holding a flag.,149676
29935,7754652028.jpg,Two people are in the streets holding flags.,149677
29935,7754652028.jpg,Two guys hold up a flag at a festival.,149678
29935,7754652028.jpg,A man a woman posing for a picture.,149679
21771,4706793376.jpg,"An older asian woman, dressed in a white t-shirt and blue gym pants, doing a form of yoga.",108855
21771,4706793376.jpg,A woman with blue and white pants on is posing some kind of martial arts move.,108856
21771,4706793376.jpg,A woman wearing blue pants and a white top outdoors exercising.,108857
21771,4706793376.jpg,An elderly man doing yoga.,108858
21771,4706793376.jpg,A woman who is doing yoga.,108859
4640,230100504.jpg,Two girls with long hair stand in front of a cluttered table.,23200
4640,230100504.jpg,A woman is pouring a drink while talking to another woman.,23201
4640,230100504.jpg,A girl in black pouring a drink into a bright red cup.,23202
4640,230100504.jpg,Two girls at a part pouring drinks.,23203
4640,230100504.jpg,Two Women drinking at party.,23204
25087,4974363190.jpg,"A woman wearing a blue skirt, high heels, a white shirt, green jacket and headband is walking out of a tunnel.",125435
25087,4974363190.jpg,A young woman in a white blouse and blue skirt walks away from a building.,125436
25087,4974363190.jpg,A woman wearing a white blouse is walking away from a building.,125437
25087,4974363190.jpg,Two people walking down a road leading out of a large building.,125438
25087,4974363190.jpg,Two woman walk along a white and steel path with walls.,125439
10856,3098336319.jpg,A snowboarder rides a rail on the cement handrail of steps with snow all around.,54280
10856,3098336319.jpg,In the snow a person on a board traverses down a concrete wall beside bleachers.,54281
10856,3098336319.jpg,A snowboarder is sliding down a cement wall at night.,54282
10856,3098336319.jpg,A snowboarder is grinding down a long concrete rail.,54283
10856,3098336319.jpg,A person doing a trick on a snowboard.,54284
13573,3425069551.jpg,A man in a pink and yellow shirt and blue headband is holding a tennis racquet whilst standing with his mouth open.,67865
13573,3425069551.jpg,A man with the tennis racket is wearing a blue headband and blue wristbands and playing tennis.,67866
13573,3425069551.jpg,A male tennis player with a blue headband is holding a racquet,67867
13573,3425069551.jpg,"Nadal celebrating, wearing a green headband",67868
13573,3425069551.jpg,A male tennis player pumps his fist.,67869
26238,5420765124.jpg,"A young woman stands outside in the snow, wearing a jacket and a backpack, standing in snowshoes, while her black dog faces away from the camera.",131190
26238,5420765124.jpg,A bundled up Asian girl wearing a Camelbak and walking shoes walking her dog in a snowy forest.,131191
26238,5420765124.jpg,A woman in winter gear with trekking poles is holding a leashed dog in the snow.,131192
26238,5420765124.jpg,"A girl, in snowshoes, goes for walk with her dog in the snowy forest.",131193
26238,5420765124.jpg,An asian female with a backpack is snowshoeing with a black dog.,131194
14504,3533470072.jpg,Two young girls one blond one brunette are puckering there lips and showing a peace sign with there fingers.,72520
14504,3533470072.jpg,Two young women in identical blue dresses giving the peace sign in an auditorium.,72521
14504,3533470072.jpg,Twp young ladies give the piece sign with their fingers to the camera.,72522
14504,3533470072.jpg,Two girls giving the peace sign.,72523
14504,3533470072.jpg,Two girls waving two fingers.,72524
29058,7109928015.jpg,"A guy in boots, jeans and a blue shirt is falling off a bull by a cowboy standing on a red fence with the numbers 2 and 4 on it.",145290
29058,7109928015.jpg,Cowboy being hit by a bull inside the bullring after falling off the bull.,145291
29058,7109928015.jpg,A cowboy is falling off a bull and looks like he might get trampled.,145292
29058,7109928015.jpg,A man being thrown into the air while being trampled by a bull.,145293
29058,7109928015.jpg,A person falling after being thrown from a bull.,145294
22814,4793246474.jpg,Men stand outside of a store with Indian writing as they transport metal buckets on a bicycle.,114070
22814,4793246474.jpg,"Two men sharing a bicycle, carrying several buckets and containers.",114071
22814,4793246474.jpg,Men on a bike transporting various sizes of metal buckets.,114072
22814,4793246474.jpg,Two men on a motorcycle with buckets and canisters.,114073
22814,4793246474.jpg,Two men are standing behind a pile of buckets.,114074
2849,1985706518.jpg,"Two people are swimming in a large body of clear blue water, and there is a large red item behind them in the water.",14245
2849,1985706518.jpg,"There are two swimmers in the ocean holding onto a rope, which has a balloon at the end of it.",14246
2849,1985706518.jpg,"Two swimmers move through pristine, bright blue waters with a bright blue skies overhead.",14247
2849,1985706518.jpg,Two people are pulling themselves on a rope in beautiful blue water.,14248
2849,1985706518.jpg,Two snorkelers are in a very blue sea swimming by an orange buoy.,14249
53,1014609273.jpg,People on two balconies and a man climbing up a pipe towards the lower balcony getting liquid poured on him.,265
53,1014609273.jpg,A kid in a red sweatshirt is reaching to hand something to a man in a white shirt,266
53,1014609273.jpg,A young boy empties a bottle over the railing of a balcony unto the man below.,267
53,1014609273.jpg,A boy in a red jacket pouring water on a man in a white shirt,268
53,1014609273.jpg,A young man pouring the contents of a bottle.,269
20840,4631205536.jpg,A man in a t-shirt and shorts is sitting on the ground holding a cup while a bottle of water lays beside him.,104200
20840,4631205536.jpg,The man in the gray shirt is staring at a man and a woman that are walking away from him.,104201
20840,4631205536.jpg,A homeless middle-aged man holding a soda cup looks at two people who have walked past.,104202
20840,4631205536.jpg,A man in a gray shirt and shorts sits in a walkway as two individuals pass him by.,104203
20840,4631205536.jpg,A man takes a break after having a meal at McDonald's.,104204
6737,2559503010.jpg,A man with a red Shriner hat is looking at watermelons in front of a bank.,33685
6737,2559503010.jpg,"There is a man, wearing a funny hat, standing in front of a bank.",33686
6737,2559503010.jpg,The man is looking at watermelons for sale outside of a bank.,33687
6737,2559503010.jpg,Dark colored Mercury car parked in front of PNC Bank.,33688
6737,2559503010.jpg,A man stands outside a bank selling watermelons.,33689
24492,4929909554.jpg,A man in a field is carrying two bundles of straw on a stick across his shoulder.,122460
24492,4929909554.jpg,One man carrying stacks of hay in a grassy field.,122461
24492,4929909554.jpg,The man is walking through a field carrying hay.,122462
24492,4929909554.jpg,A man in a field is gathering hay on a pole.,122463
24492,4929909554.jpg,A worker bringing crops to his homeland.,122464
11696,320199844.jpg,A man in a Santa Claus costume is sitting on a wooden chair holding a microphone and a stringed instrument.,58480
11696,320199844.jpg,Large old man dressed as Santa Claus singing in a mic with a guitar on the street.,58481
11696,320199844.jpg,A guitar player dressed as Santa Claus is getting ready with his mic.,58482
11696,320199844.jpg,A man dressed as Santa sitting on a chair playing a banjo.,58483
11696,320199844.jpg,Santa Clause singing a song and playing his guitar.,58484
5607,2423254262.jpg,"A woman in a red sweater is resting her head on the shoulder of a man sitting next to her with a beard, blue jacket and jeans while riding public transportation.",28035
5607,2423254262.jpg,"People on public transportation, a couple is resting on each other.",28036
5607,2423254262.jpg,A passenger on a train is sleeping with a girl next to his seat.,28037
5607,2423254262.jpg,People getting tired while travelling.,28038
5607,2423254262.jpg,Sleepy subway passengers.,28039
8372,2774041957.jpg,A boy in an orange shirt plays on a large drainpipe with several other children in a sandy area.,41860
8372,2774041957.jpg,A little black boy with an orange tank top and shorts jumped to the sand below.,41861
8372,2774041957.jpg,Children play barefoot in the sand next to a rusting oil pipeline.,41862
8372,2774041957.jpg,"Boy in orange, jumping off a rusted colored pipe, into sand.",41863
8372,2774041957.jpg,A child jumps off of pipes at a sandy beach.,41864
7796,270419656.jpg,Two adults and three small children are walking on a sidewalk in a park-like setting.,38980
7796,270419656.jpg,Three kids run in front of their mother in a park.,38981
7796,270419656.jpg,Children walk down a path on a sunny fall day.,38982
7796,270419656.jpg,Small children romping through a park.,38983
7796,270419656.jpg,Group of kids in the park,38984
22344,4753058300.jpg,A man with brown hair walking his bicycle across the street.,111720
22344,4753058300.jpg,A street crossing where a woman is walking her bike across,111721
22344,4753058300.jpg,A woman is walking a blue bike across a road.,111722
22344,4753058300.jpg,6 women walk across a city street.,111723
22344,4753058300.jpg,A man walks astride a blue bike.,111724
15688,367673290.jpg,The woman wearing a black and white jacket and red boots is also wearing headphones.,78440
15688,367673290.jpg,Blond woman wearing red boots with a bland and white jacket walking down the street.,78441
15688,367673290.jpg,A lady walking in red boots while wearing headphones.,78442
15688,367673290.jpg,A woman in a black and white coat and earmuffs.,78443
15688,367673290.jpg,A woman dressed in winter wear walks outdoors.,78444
13245,3382105769.jpg,A dog with a stick in its mouth runs through the rocks in shallow water.,66225
13245,3382105769.jpg,A dog running with something in his mouth in shallow water.,66226
13245,3382105769.jpg,A soaking wet dog is splashing through the water.,66227
13245,3382105769.jpg,A brown dog retrieves a stick in a rocky river,66228
13245,3382105769.jpg,A dog running through a creek.,66229
24902,4958978125.jpg,A group consisting of two men wearing religious garb and a woman wearing a black leather jacket and jeans all ride vintage bicycles on a street.,124510
24902,4958978125.jpg,Two men dressed in white robes and red capes ride bicycles while carrying staffs topped with skulls.,124511
24902,4958978125.jpg,Many people in costume are riding their bikes in a public place.,124512
24902,4958978125.jpg,Two guys with red capes ride bikes down the street.,124513
24902,4958978125.jpg,Two people in costumes are riding a bike.,124514
30692,86729182.jpg,A young oriental girl and another person are watching a young toddler dressed in a pink sweater and white knit cap.,153460
30692,86729182.jpg,Two little Asian kids are dressed warmly in colorful jackets while standing on the playground.,153461
30692,86729182.jpg,"A small child in a pink jacket and a bear hat, With two older women.",153462
30692,86729182.jpg,Three Asian children are hanging out in a group outside.,153463
30692,86729182.jpg,A young Asian girl with a white bear stocking hat.,153464
23623,4855045103.jpg,A man in a white shirt playing an electric violin in front of a white brick wall.,118115
23623,4855045103.jpg,A man playing a violin like instrument advertising a coffee drink.,118116
23623,4855045103.jpg,A man playing a unique violin while looking up at the ceiling.,118117
23623,4855045103.jpg,A man playing a strange looking violin.,118118
23623,4855045103.jpg,A man playing an electric violin.,118119
19918,4526977553.jpg,"A woman wearing a white blouse, blue jeans and heels, runs across the street to avoid oncoming traffic.",99590
19918,4526977553.jpg,A woman wearing tight jeans and high heels is running across the road.,99591
19918,4526977553.jpg,A woman wearing jeans is walking down the street.,99592
19918,4526977553.jpg,Lady in heels and blue jeans crossing the street.,99593
19918,4526977553.jpg,Lady in heels running across the street.,99594
30659,86132021.jpg,"A man wearing only a hat, boots, and underwear is walking the sidewalk with a guitar strapped around his shoulder.",153295
30659,86132021.jpg,Several people are posing for a photo with the naked cowboy in NYC.,153296
30659,86132021.jpg,"Three women and a man dressed as the ""naked cowboy"" in New York.",153297
30659,86132021.jpg,Passersby interact with New York's Naked Cowboy.,153298
30659,86132021.jpg,Three women posing with the naked cowboy.,153299
1124,135235570.jpg,A man tries to catch a football on grass surrounded by American flags.,5620
1124,135235570.jpg,A man is being thrown a Frisbee in front of a monument and flags.,5621
1124,135235570.jpg,A man is clapping at the base of the Washington Memorial.,5622
1124,135235570.jpg,A man in a field backed by american flags.,5623
1124,135235570.jpg,A man stands in front of the Gateway Arch.,5624
14078,3484365373.jpg,A young blond woman in a blue and white tracksuit jumps a hurdle.,70390
14078,3484365373.jpg,A girl in a blue and white uniform is jumping over a hurdle.,70391
14078,3484365373.jpg,A woman in a track uniform jumping over a hurdle.,70392
14078,3484365373.jpg,A woman jumping over a hurdle during a race.,70393
14078,3484365373.jpg,A tall girl hurdles.,70394
30559,835606668.jpg,Two little girls dance barefoot in the park near other people and a large black blow up balloon.,152795
30559,835606668.jpg,"Children dance in a park in front of a large, black, inflatable object.",152796
30559,835606668.jpg,Two little girls in dresses are in front of an inflatable balloon.,152797
30559,835606668.jpg,Children dancing around a parade float.,152798
30559,835606668.jpg,People attending an event in a park.,152799
24606,4936228037.jpg,"An asian woman stands in front of a wooden chair on a floating dock with a stick in her hand that has two big black birds perching on it, while a man on the rock shoreline takes a photo.",123030
24606,4936228037.jpg,"An Asian woman with a hat is standing on a pier, holding a long stick with two black birds sitting on it, while a man on the shore takes a photograph",123031
24606,4936228037.jpg,Man taking a picture of a woman on an oriental pier on the water while she balances two large black birds on a long stick.,123032
