imgid,filename,caption,sentid
29904,7729005930.jpg,A rally car bears down on the camera while kicking up a plume of dust.,149521
29904,7729005930.jpg,A red and white Ford Edge is driven by a professional driver.,149522
29904,7729005930.jpg,This is a red and white sports car going down a dirt road.,149523
29904,7729005930.jpg,A driver is racing his Ford vehicle on a gravel track.,149524
24612,4936351064.jpg,A couple in white shorts walk down a narrow street lit by yellow sodium lights.,123060
24612,4936351064.jpg,Couple walks down a lighted busy street with older style buildings.,123061
24612,4936351064.jpg,A busy street full of shops and people holding hands and walking.,123062
24612,4936351064.jpg,A couple walks down a pedestrian street at night.,123063
24612,4936351064.jpg,People strolling a city street at night.,123064
984,1317292658.jpg,A boy is squinting while being sprayed with water from a flat ground surface.,4920
984,1317292658.jpg,A boy wearing black swimming trunks is standing in a fountain.,4921
984,1317292658.jpg,A boy in swim trunks screams while being sprayed with water.,4922
984,1317292658.jpg,A boy in bathing trunks is standing under a water shower.,4923
984,1317292658.jpg,A boy enjoys a rain shower.,4924
18424,428483413.jpg,A woman with dirty blond-hair and sunglasses and a man with dark hair stand in front of a record store.,92120
18424,428483413.jpg,A woman and a man are passing by a window displaying a record.,92121
18424,428483413.jpg,A blond girl standing in front of a large metal fan,92122
18424,428483413.jpg,A man and woman walking past a record shop,92123
18424,428483413.jpg,A woman and a man stand outside a store.,92124
15813,3692396278.jpg,"A father and his son at the park, the dad has a bike propped up onto a tree checking the tire while his son is studying the tree.",79065
15813,3692396278.jpg,Boy wearing helmet stands by tree while man wearing helmet checks bicycle wheel.,79066
15813,3692396278.jpg,"A man and a young boy are outside, taking a break from riding a bike.",79067
15813,3692396278.jpg,"A guy and his son, in helmets, are putting up their bike.",79068
15813,3692396278.jpg,"A man, and presumably his son, out on a bike ride.",79069
26376,549887636.jpg,A man dressing in a black shirt is waiting to cross the street with traffic.,131880
26376,549887636.jpg,An asian man tries to jaywalk on a street with heavy traffic.,131881
26376,549887636.jpg,Man waits for taxis to pass before crossing the wet road.,131882
26376,549887636.jpg,A man waiting for traffic to stop at road crossing,131883
26376,549887636.jpg,A man standing in a crosswalk,131884
23732,4860393512.jpg,Two men are sitting on a wooden bench sleeping on each other.,118660
23732,4860393512.jpg,"Two people, sitting on a park bench, taking a nap.",118661
23732,4860393512.jpg,Two men on a park bench holding hands taking a nap.,118662
23732,4860393512.jpg,An elderly woman leaning on a man on a bench.,118663
23732,4860393512.jpg,Two men sit on a street bench together.,118664
7058,2601746926.jpg,"In the center of a town there is a man in this streets dressed in shorts and a t-shirt performing for those who pass, while a woman watches.",35290
7058,2601746926.jpg,A man with black shorts and a red shirt is standing on cobblestones.,35291
7058,2601746926.jpg,Man playing with fire in the street to entertain passersby.,35292
7058,2601746926.jpg,A man in a red shirt on the city street doing a fire trick.,35293
7058,2601746926.jpg,A street performer in a red shirt.,35294
17419,4019072184.jpg,"A rock climber dressed in yellow and wearing a red safety helmet is scaling the smooth wall of a high cliff, while another member looks on from the boat in the water.",87095
17419,4019072184.jpg,"Looking down from the top of a cliff, a man is climbing the cliff wall in an attempt to make it to the top.",87096
17419,4019072184.jpg,There is a man in a red helmet climbing a mountain near a big body of water.,87097
17419,4019072184.jpg,A person is climbing a cliff wall that overlooks water.,87098
17419,4019072184.jpg,A man is rock climbing with protective rope.,87099
13924,3468023754.jpg,Children looking through magazines they have folded into tubes,69620
13924,3468023754.jpg,Four children look through rolled magazines like telescopes.,69621
13924,3468023754.jpg,Four children hold rolled up magazines to their eyes.,69622
13924,3468023754.jpg,Four children looking through rolled up booklets.,69623
13924,3468023754.jpg,Four children look through rolled-up magazines.,69624
7246,2629294578.jpg,"There is a tan dog in the middle of a field, fetching a tennis ball.",36230
7246,2629294578.jpg,A dog is fetching a tennis ball in a patch of green grass.,36231
7246,2629294578.jpg,Brown dog chases after yellow ball in park,36232
7246,2629294578.jpg,A large dog chases a ball outdoors.,36233
7246,2629294578.jpg,A brown dog is fetching a ball.,36234
22469,4761384077.jpg,People waiting for a train on the underground platform of an urban metro system.,112345
22469,4761384077.jpg,Two people are standing while others are walking or rushing by.,112346
22469,4761384077.jpg,There are several people waiting to get on the subway.,112347
22469,4761384077.jpg,People waiting at a underground subway station.,112348
22469,4761384077.jpg,Several people waiting on the subway.,112349
1500,1434753225.jpg,"In a room with clothes strewn on the bed, a man appears to be falling onto the bed from a high distance.",7500
1500,1434753225.jpg,A man suspended in the air is about to fall onto a pile of laundry on his bed.,7501
1500,1434753225.jpg,A man in a black shirt and jeans is in midair above a messy bed.,7502
1500,1434753225.jpg,A man is falling from the ceiling on top of a bed.,7503
1500,1434753225.jpg,A man is jumping unto his filthy bed.,7504
27952,640173336.jpg,A dirt biker with the number 94 on it twice ridden by a man wearing white and blue with a blue helmet.,139760
27952,640173336.jpg,A dirt-bike racer taking a hard turn on a dirt course with one onlooker in the background.,139761
27952,640173336.jpg,A man in the distance watches another person ride a dirt bike.,139762
27952,640173336.jpg,The dirt bike rider is driving the number 94 bike.,139763
27952,640173336.jpg,"Motorcycle track, and rider.",139764
7544,2665586311.jpg,"The girl dressed in purple walks through the alley, followed by a girl in pink.",37720
7544,2665586311.jpg,"A girl in pink pants running, an ornate Spanish ruin in the background.",37721
7544,2665586311.jpg,Two little girls play around an old abandoned building.,37722
7544,2665586311.jpg,Two children within the ruins of a building.,37723
7544,2665586311.jpg,"Two girls, one running away from the wall.",37724
21850,4715216920.jpg,A man in blue jeans and a white shirt walks along a dirty street in front of fencing that is covered in posters and graffiti.,109250
21850,4715216920.jpg,A man walking down a dirty street in front of a building that has graffiti and posters on it.,109251
21850,4715216920.jpg,A man wearing a white shirt and jeans is walking by looking at a large advertisement poster.,109252
21850,4715216920.jpg,A man in a white shirt and jeans is walking in front of a graffiti covered wall.,109253
21850,4715216920.jpg,A man walks past weathered posters on urban street.,109254
3682,2159526836.jpg,A person in a hooded sweatshirt is embracing a man on the couch while partially covered by an off-white comforter.,18410
3682,2159526836.jpg,A man and a woman are sitting on a yellow couch laughing under a yellow comforter with white daisies.,18411
3682,2159526836.jpg,A man and a woman lay next to each other on a couch under a blanket.,18412
3682,2159526836.jpg,Two people are playing on the couch laughing under a blanket.,18413
3682,2159526836.jpg,A couple cuddles under a blanket on a couch.,18414
6932,258476074.jpg,A line of off-road vehicles is parked on the hill outside a wooded area.,34660
6932,258476074.jpg,A group of off road vehicles parked together high in the mountains.,34661
6932,258476074.jpg,A group of vehicles are parked on a hill in the fall.,34662
6932,258476074.jpg,A group of cars parked on a hill,34663
6932,258476074.jpg,Many cars parked on a mountain.,34664
16054,372160542.jpg,A man with a gray beard and a little boy are sitting on the floor looking over some papers in a room with a bunk bed.,80270
16054,372160542.jpg,A man in a blue shirt playing with a young boy in a red shirt on the ground in a bedroom.,80271
16054,372160542.jpg,A dad and his son are playing with some Legos in the child's bedroom.,80272
16054,372160542.jpg,A man and bot playing on the floor with bunk beds in the background.,80273
16054,372160542.jpg,"Father and son are in the child's room, putting together a toy.",80274
13225,3379896474.jpg,"A person with long, blond-hair wearing a bandanna drinks from a beer bottle while standing in front of window blinds.",66125
13225,3379896474.jpg,A white male with blond-hair is drinking beer.,66126
13225,3379896474.jpg,A man with long hair is drinking a beer.,66127
13225,3379896474.jpg,A man drinking out of a glass bottle.,66128
13225,3379896474.jpg,A man is drinking a beer.,66129
12649,3317992490.jpg,A woman wearing a purple sweater pedals a bicycle down the street with a basket on th front.,63245
12649,3317992490.jpg,An african american woman is riding a bicycle down the street.,63246
12649,3317992490.jpg,An African-American woman rides a bike down the road.,63247
12649,3317992490.jpg,A woman is riding a bike while wearing a helmet.,63248
12649,3317992490.jpg,A black woman wearing a helmet rides her bike.,63249
19145,4441842421.jpg,A man in a blue shirt is walking and there is a blue bucket that can be seen.,95725
19145,4441842421.jpg,"This man is wearing a shirt that says ""coolest dad in the world"".",95726
19145,4441842421.jpg,A man walks along wearing a 'coolest dad' T-shirt.,95727
19145,4441842421.jpg,A man stands in field next to a blue bucket.,95728
19145,4441842421.jpg,A guy in a blue t-shirt is in the park.,95729
28992,7061899189.jpg,Photo is of a man on a motorcycle tied to a couple on a modified truck going down a road (and the median) in a dusty town.,144960
28992,7061899189.jpg,A very man on a motorcycle and 2 men on a cart are traveling down a dusty two lane road.,144961
28992,7061899189.jpg,Young men on wheels are driving down a dirt road with pavement to the left side.,144962
28992,7061899189.jpg,A motorcyclist and uncovered truck drive along a dessert street.,144963
28992,7061899189.jpg,A dusty street setting of an impoverished third-world country.,144964
5299,2386366590.jpg,One shirtless man in blue pants and another person in a black shirt and white pants stand on a lawn.,26495
5299,2386366590.jpg,A group of individuals attend a park where they practice their martial arts.,26496
5299,2386366590.jpg,A shirtless got in blue pants is being chased by a girl in a black shirt.,26497
5299,2386366590.jpg,Tehse people are exercising using the Oriental Ti Chi.,26498
5299,2386366590.jpg,A group of children appear to be playing outside.,26499
3686,2160266952.jpg,Two children dressed in black bounce on red and green bouncy balls in a garage.,18430
3686,2160266952.jpg,The children are wearing black tights while hopping.,18431
3686,2160266952.jpg,Two kids are bouncing on colorful balls.,18432
3686,2160266952.jpg,Two young children bouncing on balls.,18433
3686,2160266952.jpg,A boy and a girl bouncing on a ball,18434
20899,463554115.jpg,An Asian lady wearing a blue blouse and an umbrella in her right hand waiting for somebody to come and pick her up because she has a lot of baggage with her.,104495
20899,463554115.jpg,Woman with a light blue umbrella and luggage sitting on the stone ground while people walk past.,104496
20899,463554115.jpg,An asian woman is sitting in a plaza with her luggage and holding a pale blue umbrella.,104497
20899,463554115.jpg,A woman wearing a tank top is holding a blue umbrella and kneeling next to luggage.,104498
20899,463554115.jpg,A woman is holding a teal umbrella while sitting down.,104499
17097,3944497603.jpg,A person in an orange coat with a hood lays on top of the entrance corridor to the metro.,85485
17097,3944497603.jpg,A person in an orange jumpsuit is laying over a metro station.,85486
17097,3944497603.jpg,A person in orange clothing rests above a metro entrance.,85487
17097,3944497603.jpg,Person in orange clothing lying on a wall,85488
17097,3944497603.jpg,Bus worker sleeping on building ledge.,85489
5196,2372751425.jpg,"An older white men wearing a black hat and yellow shirt looking down holding a cigarette, standing in a store with pictures on the walls and plaques on the table and floor.",25980
5196,2372751425.jpg,A man in a white shit and beret amongst many gold items.,25981
5196,2372751425.jpg,A skilled gold worker works on his next piece of art.,25982
5196,2372751425.jpg,Man in room filled with fancy picture frames.,25983
5196,2372751425.jpg,An older man working on antiques,25984
19765,4510135650.jpg,"A man in urban street gear including a striped hoodie looks down at something in his hand, in front of a brick-and-glass storefront.",98825
19765,4510135650.jpg,A person wearing a blue and white hooded jacket playing with a device is standing outside a store with a sale sign on windows.,98826
19765,4510135650.jpg,A person in a striped blue and white hooded sweatshirt is standing by a window.,98827
19765,4510135650.jpg,A person standing in front of a store is taping on a cellphone.,98828
19765,4510135650.jpg,Person in striped hoodie and jeans standing in front of store,98829
14203,3498417123.jpg,"While the green team gets ready to tackle, the red team has the ball.",71015
14203,3498417123.jpg,A rugby match in progress is shown with the referee watching.,71016
14203,3498417123.jpg,A group of men are playing ball together.,71017
14203,3498417123.jpg,Seven men are in action playing rugby.,71018
14203,3498417123.jpg,A group of men play rugby.,71019
22375,4755872312.jpg,There is three small children playing and some adults are sitting on the benches.,111875
22375,4755872312.jpg,"3 children on brick street, near a lamp post, trashcan and some adults.",111876
22375,4755872312.jpg,Three children are playing outside and one of them is unhappy.,111877
22375,4755872312.jpg,Three children are standing outside with a bird flying by.,111878
22375,4755872312.jpg,Children watch a pigeon in a public square.,111879
23836,4868909807.jpg,Women are seated on benches facing the aisle and holding poles.,119180
23836,4868909807.jpg,Several women sit holding handrails on an incline shuttle.,119181
23836,4868909807.jpg,A group of women are sitting down holding onto hand bars.,119182
23836,4868909807.jpg,Asian women hold on to the bars as they begin to move.,119183
23836,4868909807.jpg,Three women are sitting next to a staircase.,119184
14810,3568065409.jpg,A boy in shorts and white shirt is jumping whilst holding a pink stick in front of a large tree surrounded by sacks.,74050
14810,3568065409.jpg,A small boy in a white shirt is jumping with a sword in his hand.,74051
14810,3568065409.jpg,A boy holding a lightsaber jumps in the middle of the street.,74052
14810,3568065409.jpg,A young boy jumps in the street while holding a stick.,74053
14810,3568065409.jpg,A boy holding a stick jumping Ont he street.,74054
30766,89404014.jpg,Three firemen in uniform are putting out a fire.,153830
30766,89404014.jpg,Fire men wearing yellow hat's spraying a hose.,153831
30766,89404014.jpg,Three firefighters work to put out a blaze.,153832
30766,89404014.jpg,Firefighters putting out a fire.,153833
30766,89404014.jpg,Firemen are putting our a fire.,153834
18269,4242032129.jpg,Three soccer players walking or standing on the field during the day.,91345
18269,4242032129.jpg,Soccer players from opposing teams are looking to the sidelines.,91346
18269,4242032129.jpg,Soccer players standing around on a field.,91347
18269,4242032129.jpg,Three soccer players standing on a field.,91348
18269,4242032129.jpg,Soccer players standing on a green field.,91349
17362,400345058.jpg,A silhouette of a child playing in the beautiful ocean at sunset.,86810
17362,400345058.jpg,A man walking in the water on the shore.,86811
17362,400345058.jpg,A person is wading in the ocean.,86812
17362,400345058.jpg,A person standing in the ocean.,86813
17362,400345058.jpg,A man standing in the water.,86814
11284,315574711.jpg,A lady holding a little boy while a baby in the background is crying.,56420
11284,315574711.jpg,This is a mother embracing her child in a daycare facility.,56421
11284,315574711.jpg,A brunette woman holds a child in a busy daycare.,56422
11284,315574711.jpg,A woman holding a young boy in a day care center.,56423
11284,315574711.jpg,A woman is holding a small child.,56424
29222,7232861768.jpg,"A wrestler squats atop the corner ropes of a ring, his foe lying on the ground with onlookers watching the match.",146110
29222,7232861768.jpg,One wrestler is ready to jump on another from the ropes of a wrestling ring.,146111
29222,7232861768.jpg,"The wrestler in garish makeup, prepares to body slam his tattooed opponent.",146112
29222,7232861768.jpg,A wrestling match is going on while a crowd watches.,146113
29222,7232861768.jpg,The image links are broken.,146114
17463,4030620867.jpg,A man in a light green shirt and jeans on a street corner pointing to a location out of view of the picture for a woman in white pants.,87315
17463,4030620867.jpg,A woman and a man pointing to the left are on a street corner in front of a green store that sells tobacco and magazines.,87316
17463,4030620867.jpg,A man on a street corner is giving someone directions.,87317
17463,4030620867.jpg,"People shopping, and around the corner store.",87318
17463,4030620867.jpg,People stand around Conna Store.,87319
17471,4032238990.jpg,A man with a mustache wearing a black and red plaid shirt plays guitar.,87355
17471,4032238990.jpg,The gentleman wearing a black bandanna is playing a five-string bass.,87356
17471,4032238990.jpg,Two men are playing guitar and one man is singing in a club,87357
17471,4032238990.jpg,A man in a checkered shirt playing guitar.,87358
17471,4032238990.jpg,A band plays their music indoors.,87359
22257,4745661523.jpg,"A young girl in a bikini is standing in a building with people around her, while she is holding a red bandanna.",111285
22257,4745661523.jpg,A young female in her underwear holding a red scarf in front of a line to get into a club.,111286
22257,4745661523.jpg,An oriental lady posing wearing a black bra and holding a handkerchief.,111287
22257,4745661523.jpg,A young woman in a skimpy clothing stands next to a line of men.,111288
22257,4745661523.jpg,A lady with brown hair standing.,111289
23493,484443289.jpg,"An old man in a baseball hat and an old woman in a jean jacket are standing outside, but are covered mostly in shadow.",117465
23493,484443289.jpg,A man wearing a gray ball cap walks next to a redheaded woman wearing a long-sleeved blue jean shirt.,117466
23493,484443289.jpg,A man and woman standing under a covered patio with the sun beaming through the trellis slats.,117467
23493,484443289.jpg,Older couple is covered in shadows by a bridge.,117468
23493,484443289.jpg,Two elderly people in a dimly lit area.,117469
30668,86289690.jpg,Four children sitting in red chairs staring intently on whats in front of them.,153340
30668,86289690.jpg,Four kids are watching television while sitting in chairs.,153341
30668,86289690.jpg,Young children sitting and watching a projector film.,153342
30668,86289690.jpg,Young minds are always willing to learn.,153343
30668,86289690.jpg,Three children are watching a movie.,153344
7068,260231029.jpg,Two dogs one black the other brown on a sandy ground the tan dog is behind the black dog.,35340
7068,260231029.jpg,A black dog and brown dog are running around in the sand.,35341
7068,260231029.jpg,A black dog plays with a brown dog on the sand.,35342
7068,260231029.jpg,A brown dog and a black dog in the sand.,35343
7068,260231029.jpg,Two dogs playing on a sandy beach,35344
19019,4425850083.jpg,A man sitting on a running horse on a dirt track.,95095
19019,4425850083.jpg,A boy rides a horse down a dusty country road.,95096
19019,4425850083.jpg,A person is riding a horse down a dirt trail.,95097
19019,4425850083.jpg,A jockey training his horse.,95098
19019,4425850083.jpg,Man swiftly riding a horse.,95099
21368,4678072371.jpg,"A silver car is passing by the entrance of the Hotel Carmel, and several people are outside.",106840
21368,4678072371.jpg,A silver car driving by a Hotel where people are standing outside of.,106841
21368,4678072371.jpg,People unloading their car outside the Hotel Carmel.,106842
21368,4678072371.jpg,"Cars and people are outside of ""Hotel Carmel.""",106843
21368,4678072371.jpg,"This is a street view of the ""Hotel Carmel"".",106844
353,1118752484.jpg,Multiple people walking on the pavement with a fence in the background all under the sky with clouds.,1765
353,1118752484.jpg,A woman in Muslim attire is walking with a young boy down the street.,1766
353,1118752484.jpg,Several people walking across a bridge in both directions.,1767
353,1118752484.jpg,People are walking in front of a fenced area.,1768
353,1118752484.jpg,Woman in a red sari walks down the street.,1769
11893,3222911432.jpg,Two young boys wearing matching New York Giants outfits are playing with laundry.,59465
11893,3222911432.jpg,Two young boys are playing with a laundry basket with clothes all over the floor.,59466
11893,3222911432.jpg,Two toddlers with NY Giants pajamas on play with the clean laundry.,59467
11893,3222911432.jpg,Two children wearing Giants clothing are playing with laundry.,59468
11893,3222911432.jpg,Two toddlers in sports outfits sit amidst scattered laundry.,59469
24735,4945010141.jpg,Two young women wearing bikini tops and short jean shorts are having a conversation while one is carrying a pink bag and the other a drink.,123675
24735,4945010141.jpg,Two females are wearing bikini tops and very short shorts while walking down the street.,123676
24735,4945010141.jpg,Two women wearing bikini tops and jean shorts walking down a street.,123677
24735,4945010141.jpg,Two women in bikini tops are talking to each other while walking.,123678
24735,4945010141.jpg,Women in bikinis are walking down a street,123679
26190,5404491005.jpg,A woman and a child wearing snow skiing gear sitting on the side of a snow covered mountain.,130950
26190,5404491005.jpg,A mother helping her small daughter with her skis on a sunny day on the slopes.,130951
26190,5404491005.jpg,A woman holding a child sitting down on a snowy mountain with their skis on.,130952
26190,5404491005.jpg,A woman and a child are sitting in the snow amongst ski gear.,130953
26190,5404491005.jpg,A woman sits in the snow with a young child on her lap.,130954
11133,3134644844.jpg,A man with a guitar playing to an ill little girl in a hospital bed.,55665
11133,3134644844.jpg,A man is playing a guitar for a little girl in a hospital.,55666
11133,3134644844.jpg,A man is playing the guitar for a child in a hospital bed,55667
11133,3134644844.jpg,A man plays a guitar for a sick child in a hospital,55668
11133,3134644844.jpg,A man plays guitar for a girl in the hospital.,55669
28682,6924870910.jpg,"Photo taken from underneath a motocross rider on his bike, balancing his back tire on a single rock, looking down at the photographer with a clear blue sky and shining sun behind him.",143410
28682,6924870910.jpg,A person on a bicycle is jumping over grass and rocks on an outside trail with a mountain in the background.,143411
28682,6924870910.jpg,"A biker, wearing full protective gear including helmet, is jumping over a rock.",143412
28682,6924870910.jpg,Extreme BMX biker going over a jump in front of a scenic mountain.,143413
28682,6924870910.jpg,A man ramps his dirt bike off of a large rock,143414
11261,3153594764.jpg,"Two men are standing together, and one man is holding a cane.",56305
11261,3153594764.jpg,The two old man is talking to each other.,56306
11261,3153594764.jpg,Two older men are having a conversation.,56307
11261,3153594764.jpg,Two old men are having a conversation.,56308
11261,3153594764.jpg,Two old guys talking to each other,56309
1264,1387461595.jpg,Two men in hi-viz jackets are talking to a man in suit next to the Penzance welcome sign that is carved into a rock.,6320
1264,1387461595.jpg,"These men are standing next to a ""Penzance welcomes you"" stone.",6321
1264,1387461595.jpg,A man in a suit and two men in orange vests standing around,6322
1264,1387461595.jpg,Three men standing near a large stone sign.,6323
1264,1387461595.jpg,Men are standing beside a stonesign,6324
18399,427683329.jpg,"Closeup of the side of an old woman's face with oversized sun blocking glasses, gray hair and a gold earring.",91995
18399,427683329.jpg,"An older woman with big sunglasses sits behind a man in a yellow shirt, perhaps at a ballgame or other event.",91996
18399,427683329.jpg,An old white-haired lady wearing sunglasses is sitting behind a man in yellow.,91997
18399,427683329.jpg,An older woman in sunglasses sits behind a man in a yellow shirt.,91998
18399,427683329.jpg,Older woman wearing sunglasses and a golden earring.,91999
5195,2372541545.jpg,"A man in suspenders sits at a table at a booth, talking on a cellphone, while a few people peruse the items on the tables.",25975
5195,2372541545.jpg,"At a convention, a man takes a phone call behind the booth where he is selling things while others examine his merchandise.",25976
5195,2372541545.jpg,"A man with glasses, a green shirt and suspenders sits at a table selling books at a convention.",25977
5195,2372541545.jpg,"Man in green shirt with suspenders talking on the phone, while sitting at a table.",25978
5195,2372541545.jpg,Consumers look over products at a trade show.,25979
