imgid,filename,caption,sentid
20363,4573391235.jpg,A couples is walking outside under some trees while the flower petals are falling.,101815
20363,4573391235.jpg,"Two couples are walking under pink peach trees, while their blossoms fall.",101816
20363,4573391235.jpg,People walk under trees as their purple leaves fall and cover the ground.,101817
20363,4573391235.jpg,Five adults are walking through a leaf-covered park.,101818
20363,4573391235.jpg,A couple is walking past cherry blossom trees.,101819
10768,309059803.jpg,"A man is preparing fish in an indoor market in Asia under lights and plastic bags, and is surrounded by other people and food vendors.",53840
10768,309059803.jpg,Many people seem to be selling and buying fish in a fish market.,53841
10768,309059803.jpg,A man in blue coveralls working at a fish market.,53842
10768,309059803.jpg,A shirt booth with a man printing a shirt.,53843
10768,309059803.jpg,A butcher is working at a market.,53844
5475,241345639.jpg,The two football players in white jerseys and purple pants tackle the player in the red jersey.,27375
5475,241345639.jpg,Three football players are tackling a red uniformed football player during a football game.,27376
5475,241345639.jpg,Three football players in purple uniforms try to tackle a player in a red uniform.,27377
5475,241345639.jpg,Two football players try to tackle a player of the opposite team.,27378
5475,241345639.jpg,There is a college player being tackled in a game.,27379
13177,3374265095.jpg,"A chubby, curly-haired brunette with glasses is wearing flip-flops and a blue t-shirt while holding an odd red object.",65885
13177,3374265095.jpg,A woman in blue jeans and a blue shirt seems to be shopping and taking a picture of herself holding something.,65886
13177,3374265095.jpg,A woman in a store is holding an item in her left hand while looking away from the camera.,65887
13177,3374265095.jpg,A woman with a casual outfit and flip-flops shops in an Ikea store.,65888
13177,3374265095.jpg,Woman standing in a store with an item in hand.,65889
5145,2365507630.jpg,A person in a black shirt and black hat is playing the keyboard under colored lights.,25725
5145,2365507630.jpg,A woman with a black hat with a pink flower on it playing the keyboard.,25726
5145,2365507630.jpg,A girl in a black hat with a pink flower on it plays the keyboard.,25727
5145,2365507630.jpg,A woman with a black t-shirt and hat is playing the keyboard.,25728
5145,2365507630.jpg,A girl is playing the keyboard with her band.,25729
4394,2266901263.jpg,Two children with leg pads are performing stepping actions near another child and an adult.,21970
4394,2266901263.jpg,The three kids are wearing soccer uniforms on a grass field.,21971
4394,2266901263.jpg,Young kids with soccer gear on walking towards the camera.,21972
4394,2266901263.jpg,A woman leads three little boys in soccer uniforms.,21973
4394,2266901263.jpg,Children wear soccer uniforms.,21974
28208,6662529701.jpg,"Yellow, red, and blue flags fly in the sky as a diver extends fully in midair.",141040
28208,6662529701.jpg,A professional diver performing a dive in front of a small crowd on a sunny day.,141041
28208,6662529701.jpg,A platform diver in mid-flight on a sunny day with spectators.,141042
28208,6662529701.jpg,A man is diving into water on a slightly cloudy day.,141043
28208,6662529701.jpg,A man is diving off of a high surface.,141044
7786,2701892321.jpg,"Two martial art athletes compete in front of an audience, carefully monitored by the judge.",38930
7786,2701892321.jpg,"Two people are hitting each other in a karate match, while an audience and referee watch.",38931
7786,2701892321.jpg,There is a chun kuk do tournament with a group of spectators watching.,38932
7786,2701892321.jpg,A martial arts contest takes place in a ring in front of spectators.,38933
7786,2701892321.jpg,Two people are competing in a martial arts match.,38934
11052,3124838157.jpg,A short woman poses between two tall men in front of a store that's going out of busines.,55260
11052,3124838157.jpg,Two tall men and a short woman standing in front of a store that is having a closeout,55261
11052,3124838157.jpg,Three people standing outside a store window with two large signs in the background,55262
11052,3124838157.jpg,Three people stand in front of a store window and smile.,55263
11052,3124838157.jpg,A man and two women pose outside a retail store.,55264
17817,41105465.jpg,A man wearing an orange scarf is sitting on the grass with his legs crossed and his eyes closed,89085
17817,41105465.jpg,A man in a black jacket and orange scarf sits in a yoga pose in the grass.,89086
17817,41105465.jpg,A man wearing a hat and scarf is sitting on the lawn with his eyes closed.,89087
17817,41105465.jpg,A guy meditating on grass with his eyes closed,89088
17817,41105465.jpg,Young man meditating outside on the lawn.,89089
8489,2789937754.jpg,A woman in a red shirt stands by a man in a white shirt and a woman in a black shirt in front of a stairway.,42445
8489,2789937754.jpg,A group of people mill around while a man in a fish costume descends a staircase.,42446
8489,2789937754.jpg,An overweight family with sling across bags stand near a group of people.,42447
8489,2789937754.jpg,People walk in a building near a set of stairs.,42448
8489,2789937754.jpg,A group of people waiting in line for a game.,42449
8272,2762301555.jpg,A girl is cold after coming out of the pool and is covered by a towel.,41360
8272,2762301555.jpg,A toddler is with wet hair stands by swimming pool wrapped in a towel.,41361
8272,2762301555.jpg,A little girl is covered in a towel at a swimming pool.,41362
8272,2762301555.jpg,A wet child is shivering in a towel in front of a pool.,41363
8272,2762301555.jpg,A wet child shivers under a towel at a pool.,41364
26467,5536018727.jpg,A constructions worker scratches his backside and stands with his backside towards the viewer observing a construction site.,132335
26467,5536018727.jpg,This long time contraction worker showing how important safety is on top of a up going building.,132336
26467,5536018727.jpg,A man is wearing a hard hat and harness in a construction area.,132337
26467,5536018727.jpg,A construction man with a blue hard hat is staring down under.,132338
26467,5536018727.jpg,A construction worker is grabbing his ass.,132339
6448,2530455664.jpg,Sole fishing boater floats while being watched on shore by four other people.,32240
6448,2530455664.jpg,A lone man sits in a boat in a cave with a group of people watching nearby.,32241
6448,2530455664.jpg,"A man canoes down a river, past several people having a picnic.",32242
6448,2530455664.jpg,A man sitting in a boat is floating near a cave.,32243
6448,2530455664.jpg,An Asian fisherman sits in his boat.,32244
10178,3016708786.jpg,A group of young men wrestle with each other wielding a floppy toy sword.,50890
10178,3016708786.jpg,Two young men pretend to attack a third man with a colorful prop knife.,50891
10178,3016708786.jpg,Three men with mouths open and one is holding a fake sword,50892
10178,3016708786.jpg,The three people are playing around with a fake knife.,50893
10178,3016708786.jpg,Teenagers are playing with a toy sword.,50894
14688,3554210976.jpg,A person in a blue tracksuit carrying a package is standing on a snowy mountain,73440
14688,3554210976.jpg,A woman in blue stands on a cliff's edge holding a shopping bag.,73441
14688,3554210976.jpg,"This person, dressed in blue, is standing on a snowy mountain.",73442
14688,3554210976.jpg,A girl standing on a snowy hillside.,73443
14688,3554210976.jpg,A girl is standing on a snowy cliff.,73444
23260,4824883554.jpg,A man in a blue striped shirt and white pants stands behind two doors.,116300
23260,4824883554.jpg,An old man in a blue shirt and white pants glowers by a glass door.,116301
23260,4824883554.jpg,A man in a blue shirt is staring into double glass doors.,116302
23260,4824883554.jpg,A man standing in front of a glass door.,116303
23260,4824883554.jpg,A man in white pants standing.,116304
1647,1469107065.jpg,The tour guide wore a dark shirt and cap as he pointed out the sign listing the rules to his young passengers.,8235
1647,1469107065.jpg,A back view of a man driving a tractor and signaling with two children as passengers at the back.,8236
1647,1469107065.jpg,A man drives an orange tractor with two small children riding in the back of it.,8237
1647,1469107065.jpg,A man driving a tractor pulls along two young children for a ride.,8238
1647,1469107065.jpg,The man is driving his equipment under the archway.,8239
30183,7981209216.jpg,"Two teams, one wearing red jerseys and helmets and one wearing white jerseys and yellow helmets, are playing football on a grass field.",150915
30183,7981209216.jpg,"Two football teams in aggressive play, one team in red and the other team wearing white with yellow helmets.",150916
30183,7981209216.jpg,Two teams play a game of football; the yellow helmet team has possession of the ball and is advancing.,150917
30183,7981209216.jpg,A play happening at a local high school football game.,150918
30183,7981209216.jpg,A young man in a yellow helmet is carrying a football.,150919
4637,23008340.jpg,A young woman with her back turned on a tennis court with a ball coming from behind her.,23185
4637,23008340.jpg,"A female tennis player stands on a court, looking away from the ball.",23186
4637,23008340.jpg,A female tennis player is casually swinging her racket.,23187
4637,23008340.jpg,Woman in a white shirt and black skirt playing tennis.,23188
4637,23008340.jpg,A woman in a white shirt holds a tennis racket.,23189
21068,4650780114.jpg,"Many people populate the eating area in a building, coming and going or standing in line or digging in their purses.",105340
21068,4650780114.jpg,A busy store full of people shopping at the store.,105341
21068,4650780114.jpg,People standing in line at a food service place.,105342
21068,4650780114.jpg,Several people in a restaurant.,105343
21068,4650780114.jpg,A line of customers at a deli.,105344
737,1250854171.jpg,A man with an axe chopping wood in front of a teepee.,3685
737,1250854171.jpg,A man is chopping wood beside his teepee in a park.,3686
737,1250854171.jpg,A man in shorts is chopping wood outside a teepee.,3687
737,1250854171.jpg,A man is getting his tepee ready for a festival.,3688
737,1250854171.jpg,Man splitting wood next to a white teepee tent.,3689
2754,1945250762.jpg,A boy wearing a black shirt and blue jeans is holding gray cloth in his right hand.,13770
2754,1945250762.jpg,A young boy in a black shirt and blue jeans holding up a gray rag.,13771
2754,1945250762.jpg,Boy in black shirt holding up a piece of garbage outdoors.,13772
2754,1945250762.jpg,Man in black carrying tattered cloth.,13773
2754,1945250762.jpg,A boy cleaning up garbage,13774
24618,4937201263.jpg,"The view of a girl with short brown hair wearing a black and white bikini sitting at the edge of a dock, the ocean takes up most of the picture.",123090
24618,4937201263.jpg,"A woman, wearing a black and white swimsuit, is sitting near the edge of the water.",123091
24618,4937201263.jpg,Back shot of a short-haired woman sitting on a wooden dock dangling her feet.,123092
24618,4937201263.jpg,A woman in a bathing suit is sitting on a dock over a body of water.,123093
24618,4937201263.jpg,A lady wearing black and white sitting near the water.,123094
2591,187245342.jpg,A man in a purple shirt is riding a red bicycle.,12955
2591,187245342.jpg,A man wearing white shoes riding a red bicycle.,12956
2591,187245342.jpg,A man without a helmet is riding a red bike.,12957
2591,187245342.jpg,A man in a purple shirt riding a red bike.,12958
2591,187245342.jpg,A man riding a red bicycle down a road.,12959
4630,2299859649.jpg,A young boy wearing a red winter coat is eating and holding up a candy bar.,23150
4630,2299859649.jpg,A kid turns around with an object in hand while someone passes behind him.,23151
4630,2299859649.jpg,A young boy wearing a red coat eats a chocolate bar.,23152
4630,2299859649.jpg,A boy in a red jacket holding a stick and yelling.,23153
4630,2299859649.jpg,A young boy holds up a candy bar while yelling.,23154
14704,3556390715.jpg,A brown and white dog with a brown and black bandanna running very fast.,73520
14704,3556390715.jpg,A white and tan dog runs along the green grass.,73521
14704,3556390715.jpg,A small white dog running across a lawn.,73522
14704,3556390715.jpg,The small dogs runs in the yard.,73523
14704,3556390715.jpg,A small white dog running,73524
10474,3050650135.jpg,A man in a number ten jersey kicks a soccer ball while another team member watches.,52370
10474,3050650135.jpg,A man in a blue jersey is kicking a ball while another man watches.,52371
10474,3050650135.jpg,Two men in blue jersey tops and white shorts play soccer.,52372
10474,3050650135.jpg,Number ten is kicking the ball as number seven watches.,52373
10474,3050650135.jpg,A rugby player swings his leg back to punt the ball.,52374
19300,445348023.jpg,A man dangles from the room of an incompletely built building in the middle of a field.,96500
19300,445348023.jpg,A man laying on the roof attempting to rebuild it.,96501
19300,445348023.jpg,A man hanging off a partially framed roof.,96502
19300,445348023.jpg,Man laying on a partially built house.,96503
19300,445348023.jpg,A man is installing a roof.,96504
14584,3541474181.jpg,A red-clothed snowboarder is performing an aerial trick.,72920
14584,3541474181.jpg,A snowboarder is jumping in the air over a snow slope.,72921
14584,3541474181.jpg,A snowboarder in the air over a snowy mountain.,72922
14584,3541474181.jpg,A snowboarder is in the air.,72923
14584,3541474181.jpg,A man snowboards.,72924
25972,5316221658.jpg,"With the night sky in the background, an extreme snowboarder launches himself, off four wooden pallets that have been turned into a ramp, into the air.",129860
25972,5316221658.jpg,A person attempting a stunt using a snowboard and some wooden pallets while it is dark outside with snow on the ground.,129861
25972,5316221658.jpg,A young man snowboarding at night is midair doing a trick off a homemade ski jump.,129862
25972,5316221658.jpg,A man in a green jacket and brown pants is pictured in midair on a snowboard.,129863
25972,5316221658.jpg,A snowboarder is jumping off a snow-covered ramp made from pallets.,129864
4987,234249498.jpg,Male and female performers stand on stage holding microphones up to their lips and raising their hands in the sky.,24935
4987,234249498.jpg,Several people stand on stage with their arms held up in the air.,24936
4987,234249498.jpg,Four singers perform on stage with backup dancers.,24937
4987,234249498.jpg,A group of people on stage singing in concert.,24938
4987,234249498.jpg,Singers performing to the crowd.,24939
20719,461784003.jpg,A white male in a green shirt and brown pants is jumping in the air with his arms extended and his legs pulled up on a pile of rocks in the middle of a grassy field on a sunny day.,103595
20719,461784003.jpg,"A man who is wearing a green shirt and brown pants, appears to be very exciting, jumping in the air with his hands raised.",103596
20719,461784003.jpg,A man is outdoors in a grassy area and he has jumped up from a pile of large rocks.,103597
20719,461784003.jpg,A man wearing a green striped shirt while jumping up onto a mountain.,103598
20719,461784003.jpg,A man wearing a green shirt jumping off a rock.,103599
14774,3563668905.jpg,A painting of a man riding a mountain bike on a mountain trail.,73870
14774,3563668905.jpg,A guy riding a BMX bicycle along a trail.,73871
14774,3563668905.jpg,A person is riding a bike on a dirt road.,73872
14774,3563668905.jpg,A guy on a bike goes through dirt.,73873
14774,3563668905.jpg,A biker wearing a helmet.,73874
10425,3045118155.jpg,"A man in his office, is staring intently at the computer screen, while holding a red pen in his left hand.",52125
10425,3045118155.jpg,A man in a gray shirt and green tie is working with his computer at his office desk.,52126
10425,3045118155.jpg,A man wearing a dress shirt and tie sitting at a computer.,52127
10425,3045118155.jpg,A man at his desk is reading from his computer monitor.,52128
10425,3045118155.jpg,A man sitting in an office on a computer.,52129
22325,4751891140.jpg,Two women walking down the street while one is chatting on the phone.,111625
22325,4751891140.jpg,Two women in stylish clothes walking down the street.,111626
22325,4751891140.jpg,Two young fashionable women walking down a sidewalk.,111627
22325,4751891140.jpg,Two women out for a day of shopping.,111628
22325,4751891140.jpg,Two hispanic women walking.,111629
12397,3282897060.jpg,This man appears to be sleeping while resting his head on his hand.,61985
12397,3282897060.jpg,A woman is sitting up asleep with her head resting on her hand.,61986
12397,3282897060.jpg,A person wearing a white shirt sits and makes a face.,61987
12397,3282897060.jpg,A man who is resting his head on his hand.,61988
12397,3282897060.jpg,A woman resting her face on her hand.,61989
2980,2045443590.jpg,A large person in a gray sweatshirt and white shorts sits next to a wood working tool.,14900
2980,2045443590.jpg,Person in hooded sweatshirt that obscures their face sits next to a freshly cut log.,14901
2980,2045443590.jpg,A man in a hooded sweatshirt sitting on a toolbox.,14902
2980,2045443590.jpg,A hooded man is tampering with a video cassette.,14903
2980,2045443590.jpg,Man in gray hoodie nodding down.,14904
8670,2818735880.jpg,A group of dogs runs down a path through dry grass and bushes.,43350
8670,2818735880.jpg,Five brown dogs are walking down a grassy path.,43351
8670,2818735880.jpg,Many dogs are running the same way in a field.,43352
8670,2818735880.jpg,A pack of dogs are running away down a trail.,43353
8670,2818735880.jpg,Brown dogs are running down a trail,43354
15567,3662865.jpg,"Two kids, one in a blue coat and one in a green coat, play in the snow with shovels.",77835
15567,3662865.jpg,Two young boys wearing heavy winter clothing shovel snow near some concrete steps.,77836
15567,3662865.jpg,Two young children shovel snow outside an apartment complex.,77837
15567,3662865.jpg,Two young children are shoveling snow off a sidewalk.,77838
15567,3662865.jpg,Two children in winter coats shoveling snow outside.,77839
22172,4737733413.jpg,Woman in white outfit with red-hair and hat bicycles past a bike store.,110860
22172,4737733413.jpg,A woman dressed in white riding a white bicycle.,110861
22172,4737733413.jpg,A woman wearing a white dress riding a bicycle.,110862
22172,4737733413.jpg,A woman wearing a hat rides a bicycle.,110863
22172,4737733413.jpg,Lady riding a bike in a white dress.,110864
12920,334737767.jpg,A tan and black dog runs over a green field with its mouth open.,64600
12920,334737767.jpg,A brown and black dog running through a large grassy field.,64601
12920,334737767.jpg,The tan and black dog is running across the grass.,64602
12920,334737767.jpg,A dog gets ready to catch something in the grass.,64603
12920,334737767.jpg,A black and tan dog running in a field,64604
22329,4752196886.jpg,There is a lady in a blue top and black pants doing exercise with two other women.,111645
22329,4752196886.jpg,Three woman out on the lawn of a park area holding exercise poses.,111646
22329,4752196886.jpg,A yoga instructor teaching a yoga class or friends doing yoga.,111647
22329,4752196886.jpg,Three people doing exercises on the grass.,111648
22329,4752196886.jpg,Three women do yoga in a park.,111649
18544,431168725.jpg,A man looking at some papers while sitting at a table in a room with others who are at desks and looking at computers.,92720
18544,431168725.jpg,A man with a white shirt is sitting at a table in a room with other people and posters along the blue wall.,92721
18544,431168725.jpg,A man in a white shirt is sitting at a table looking at some papers.,92722
18544,431168725.jpg,A man in a white shirt does work at a table.,92723
18544,431168725.jpg,Various people doing different activities.,92724
2049,161329629.jpg,A group of people dress up and participate in role playing games.,10245
2049,161329629.jpg,A group of people dressed in Renaissance-era clothing converse.,10246
2049,161329629.jpg,A group of people are dressed up in costumes in the woods.,10247
2049,161329629.jpg,Men and women outside on the edge of the woods talking.,10248
2049,161329629.jpg,People in costume standing around a tree in a forest.,10249
13171,3373544964.jpg,"A buy with glasses petting his bulldog, on the pavement with woods in the background.",65855
13171,3373544964.jpg,"A boy and his dog are standing on a trampoline, enjoying each others company.",65856
13171,3373544964.jpg,A muscular dog with upturned face looking into eyes of a young boy.,65857
13171,3373544964.jpg,A boy looks at a dog while they stand on a trampoline outside.,65858
13171,3373544964.jpg,Dog with tongue out looking up at a young boy with glasses,65859
14301,3509711173.jpg,An Asian man wearing a white outfit and red vest with a sword is riding a white horse in front of a crowd.,71505
14301,3509711173.jpg,An asian man rides a horse and performs a gesture while extending a sword from his right hand.,71506
14301,3509711173.jpg,A contestant in horseback sword fighting- the crowd looks on.,71507
14301,3509711173.jpg,A man riding a horse in some sort of Chinese dueling sport.,71508
14301,3509711173.jpg,A man riding a horse while holding a sword.,71509
308,110590591.jpg,"People are standing around an American flag that is spread out, facing the wrong direction.",1540
308,110590591.jpg,Four people are holding an american flag in the middle of a bunch of people.,1541
308,110590591.jpg,A parade of people walk the street carrying the American flag.,1542
308,110590591.jpg,A group of people spread out an American flag for all to see.,1543
308,110590591.jpg,A group of people surrounding the American flag.,1544
14602,3544420941.jpg,"One man wearing a black t-shirt is helping another man, who is wearing a blue shirt, tie his necktie.",73010
14602,3544420941.jpg,A man in a black t-shirt is tying the necktie of a man wearing a blue dress shirt.,73011
14602,3544420941.jpg,A larger man is putting a tie onto a smaller man.,73012
14602,3544420941.jpg,A man making the cravat to his best friend.,73013
14602,3544420941.jpg,A father helping his son tie his tie.,73014
25524,5114909951.jpg,"Two men look through two telescopes on one tripod with a sign in front that says ""See the Sun Solar Telescopes"".",127620
25524,5114909951.jpg,"Two men, one in colorful jacket and other in blue jacket, looking at sun in solar telescopes.",127621
25524,5114909951.jpg,Two men are looking through solar telescopes that are attached to a tripod.,127622
25524,5114909951.jpg,Two men are using a solar telescope to look at the sun.,127623
25524,5114909951.jpg,Two men are looking through the solar telescopes.,127624
11220,314821286.jpg,An asian child sits on the ground eating from a bowl outside a hut on a sunny day.,56100
11220,314821286.jpg,A young boy sitting in the shade outside and eating a meal.,56101
11220,314821286.jpg,A boy eating beside a wooden house surrounded by trees.,56102
11220,314821286.jpg,A boy sitting on sand outside a wood building eating.,56103
11220,314821286.jpg,A dark-skinned boy eating a bowl of food.,56104
15445,3646453252.jpg,A person wearing a red helmet and yellow and white clothing is riding a bike outside in a wooded area.,77225
15445,3646453252.jpg,A child wearing a helmet riding a mountain bike very fast through a forest.,77226
15445,3646453252.jpg,A person wearing a red helmet riding a white bike.,77227
15445,3646453252.jpg,The BMX biker rides through the forest.,77228
15445,3646453252.jpg,A cyclist streaks through the trees.,77229
7134,261123751.jpg,A possibly drunken man lays on the ground beside a busy road.,35670
7134,261123751.jpg,A male wearing a blue shirt appears to be asleep outside.,35671
7134,261123751.jpg,A man is sleeping on the sidewalk near a busy street.,35672
7134,261123751.jpg,A man in a suit is sleeping in a chair near a street.,35673
7134,261123751.jpg,A man slumbers on a city bench.,35674
13006,3355931898.jpg,Three men in hats inspect a small outdoor recreation of a steam locomotive.,65030
13006,3355931898.jpg,Three men and a young boy are outdoors looking at a green model train.,65031
13006,3355931898.jpg,Three men and a small boy work on a green model train outside.,65032
13006,3355931898.jpg,Three men and a little boy looking at a model train.,65033
13006,3355931898.jpg,Two country men working on a model train.,65034
10259,3025549604.jpg,Four young kids are sitting on large stools at a bar waiting for drinks,51295
10259,3025549604.jpg,Four young children sitting on large bar stools next to a counter.,51296
10259,3025549604.jpg,Four children sit on tall bar stools at a yellow and gray bar.,51297
10259,3025549604.jpg,Four small children sit on tall stools at a restaurant bar.,51298
10259,3025549604.jpg,Four children on stools in a diner.,51299
3212,2084217208.jpg,"A person in a blue jacket, wearing a bicycle helmet is riding a bike",16060
3212,2084217208.jpg,A woman with a blue jacket wears a helmet as she rides a bike.,16061
3212,2084217208.jpg,A woman with a helmet riding a bike.,16062
3212,2084217208.jpg,A woman is riding her bicycle.,16063
3212,2084217208.jpg,A woman riding a bike in a park,16064
6499,2536876757.jpg,"A man in a blue hat, blue jacket, and purple gloves, looks up at a giant piece of steel he is working on.",32495
6499,2536876757.jpg,Guy in blue jacket and hat standing in front of some type of machinery while starring up with a big smile.,32496
6499,2536876757.jpg,An engineer with a blue jacket and cap wears purple gloves while looking up.,32497
6499,2536876757.jpg,A man is standing in front of a large gear.,32498
6499,2536876757.jpg,A man in blue fixing some type of machine.,32499
27919,6369706433.jpg,"Two men, one wearing a gray shirt and the other wearing a plaid coat, are fishing on a pier.",139595
